{
  "$schema": "https://json-schema.org/draft/2020-12/schema",
  "$id": "https://rhiza.dev/architecture-gates/ci-performance-baseline-attestation/1.0.0",
  "title": "Rhiza G0 CI performance baseline attestation",
  "type": "object",
  "required": ["$schema", "schema_version", "gate_id", "observation_path", "observation_sha256", "github"],
  "additionalProperties": false,
  "properties": {
    "$schema": { "const": "https://rhiza.dev/architecture-gates/ci-performance-baseline-attestation/1.0.0" },
    "schema_version": { "const": "1.0.0" },
    "gate_id": { "const": "G0" },
    "observation_path": { "const": "G0/ci-performance-baseline.json" },
    "observation_sha256": { "const": "63ce4415fab6b58cb00b0bedba716215aff066eca4ff94b89043814b2f6f1542" },
    "github": {
      "type": "object",
      "required": ["run_url", "artifact_id", "artifact_name", "artifact_digest"],
      "additionalProperties": false,
      "properties": {
        "run_url": { "const": "https://github.com/Arragon/Rhiza-Dev/actions/runs/32064755532" },
        "artifact_id": { "const": "9299491312" },
        "artifact_name": { "const": "g0-evidence-32064755532-1" },
        "artifact_digest": { "const": "sha256:b95ddd4e0ae51c57a1c3a100b05b09e3b18d30fed96c9d292228df0316c81eb3" }
      }
    }
  }
}
